"How to get a good grade in DOS in 40 minutes a day","50","195","distributed systems","1"
"RPCs for Noobs","45","3083","distributed systems","2"
"Xen and the Art of Surviving Undergraduate School","120","1196","undergraduate school","3"
"Cooking for the Impatient Undergrad","65","1650","undergraduate school","4"
"How to finish Project 3 on time","65","1650","undergraduate school","5"
"Why theory classes are so hard","65","1652","undergraduate school","6"
"Spring in the Pioneer Valley","65","1652","undergraduate school","7"
